{
    "dedicatedServerId": "",
    "region": "US",
    "gameHostBindAddress": "0.0.0.0",
    "gameHostBindPort": 32001,
    "gameHostRegisterBindAddress": "73.111.111.11",
    "gameHostRegisterPort": 32001,
    "adminPassword": "adminpassword",
    "game": {
        "name": "Server Name",
        "password": "password",
        "scenarioId": "{59AD59368755F41A}Missions/21_GM_Eden.conf",
        "playerCountLimit": 10,
        "autoJoinable": false,
        "visible": true,
        "gameProperties": {
            "serverMaxViewDistance": 1600,
            "serverMinGrassDistance": 0,
            "networkViewDistance": 500,
            "disableThirdPerson": false,
            "fastValidation": true,
            "battlEye": true
        },
        "mods": [
            { 
                "modId": "5994AD5A9F33BE57",
                "name": "Game Master FX",
                "version": "1.0.51" 
            }
        ]
    },
    "a2sQueryEnabled": true,
    "steamQueryPort": 17777
}